{
  "id": "trending-tech-batch-01",
  "topic": "This Week's Trending GitHub Repos",
  "coverTitle": "5 insane open-source tools",
  "coverTitleAccent": "you need to try.",
  "coverSubtitle": "These 5 repositories are blowing up right now. Hand-picked for maximum developer productivity.",
  "editionBadge": "WEEKLY GITHUB REPORT",
  "theme": "neon-cyberpunk",
  "repos": [
    {
      "id": "repo-1",
      "repoName": "ai-job-search",
      "fullRepo": "MadsLorentzen/ai-job-search",
      "url": "https://github.com/MadsLorentzen/ai-job-search",
      "headlineLead": "Never apply manually",
      "headlineAccent": "again.",
      "summary": "Automates the entire tech job hunt. Scrapes job boards, matches qualifications, tailors resumes, and generates cover letters.",
      "punchline": "Like having an AI recruitment agent working for you 24/7.",
      "stars": "22.8k",
      "starsNumeric": 22818,
      "language": "Python",
      "badge": "AI Agent",
      "cardDescription": "An autonomous agent that scans listings, extracts key technical requirements, and generates tailored resumes.",
      "cloneCommand": "git clone github.com/MadsLorentzen/ai-job-search",
      "useCases": ["Tailored resume generation", "Autonomous daily applications"]
    },
    {
      "id": "repo-2",
      "repoName": "DesktopCommanderMCP",
      "fullRepo": "wonderwhy-er/DesktopCommanderMCP",
      "url": "https://github.com/wonderwhy-er/DesktopCommanderMCP",
      "headlineLead": "Give Claude control of",
      "headlineAccent": "your desktop.",
      "summary": "Model Context Protocol server allowing LLMs to execute bash commands, edit files, and launch applications directly.",
      "punchline": "Turns your desktop terminal into an autonomous AI workstation.",
      "stars": "8.3k",
      "starsNumeric": 8300,
      "language": "TypeScript",
      "badge": "MCP Server",
      "cardDescription": "MCP protocol bridge giving Claude Desktop native filesystem and terminal execution rights.",
      "cloneCommand": "git clone github.com/wonderwhy-er/DesktopCommanderMCP",
      "useCases": ["Local bash execution via Claude", "System-level automated refactoring"]
    },
    {
      "id": "repo-3",
      "repoName": "OfficeCLI",
      "fullRepo": "yusufcan/OfficeCLI",
      "url": "https://github.com/yusufcan/OfficeCLI",
      "headlineLead": "MS Office without opening",
      "headlineAccent": "the app.",
      "summary": "Lightweight command-line interface for reading, editing, and generating Word, Excel, and PowerPoint documents.",
      "punchline": "Script your entire spreadsheet workflow from pure bash.",
      "stars": "12.5k",
      "starsNumeric": 12450,
      "language": "Rust",
      "badge": "CLI Tool",
      "cardDescription": "High-performance CLI utility for batch generating and formatting .docx, .xlsx, and .pptx files.",
      "cloneCommand": "git clone github.com/yusufcan/OfficeCLI",
      "useCases": ["Batch Excel data transformation", "Automated Word report generation"]
    },
    {
      "id": "repo-4",
      "repoName": "hallmark",
      "fullRepo": "anthropics/hallmark",
      "url": "https://github.com/anthropics/hallmark",
      "headlineLead": "Stop LLM hallucinations",
      "headlineAccent": "in production.",
      "summary": "Production testing harness for real-time verification and factual grounding checks on generative AI outputs.",
      "punchline": "Catches hallucinated facts before your users ever see them.",
      "stars": "16.9k",
      "starsNumeric": 16920,
      "language": "Python",
      "badge": "AI Safety",
      "cardDescription": "Production verification suite measuring output consistency and ground-truth alignment across model runs.",
      "cloneCommand": "git clone github.com/anthropics/hallmark",
      "useCases": ["RAG pipeline assertion checks", "Continuous hallucination regression tests"]
    },
    {
      "id": "repo-5",
      "repoName": "OmniRoute",
      "fullRepo": "diegosouzapw/OmniRoute",
      "url": "https://github.com/diegosouzapw/OmniRoute",
      "headlineLead": "The smart router for",
      "headlineAccent": "every LLM API.",
      "summary": "Ultra-low latency proxy that routes requests dynamically across OpenAI, Anthropic, Gemini, and local Ollama nodes.",
      "punchline": "Cuts token expenses by up to 60% without dropping quality.",
      "stars": "11.3k",
      "starsNumeric": 11340,
      "language": "Go",
      "badge": "Infra",
      "cardDescription": "High-throughput reverse proxy dispatching prompts based on cost, latency, and context-window constraints.",
      "cloneCommand": "git clone github.com/diegosouzapw/OmniRoute",
      "useCases": ["Zero-downtime model failovers", "Cost routing between fast & reasoning models"]
    }
  ],
  "installSlide": {
    "titleLead": "How to",
    "titleAccent": "install.",
    "description": "You can clone these in the terminal with git clone. But if it's your first time, paste them into any AI coding agent - Cursor, ChatGPT, Gemini or Claude - and it'll check each repo over and set it up for you.",
    "cloneHighlightRepo": "MadsLorentzen/ai-job-search",
    "agentPromptText": "check these are legit, then set them up:",
    "ctaTextLead": "Save it now, you'll want this",
    "ctaTextAccent": "list later.",
    "followButtonText": "+ FOLLOW",
    "saveButtonText": "SAVE THIS",
    "buttonStyle": "pill-capsule",
    "agentTip": "Works with Cursor • Claude 3.7 • ChatGPT • Gemini"
  },
  "settings": {
    "maxRepos": 5,
    "showSwipeHints": true,
    "aspectRatio": "vertical-9-16",
    "buttonStyle": "pill-capsule"
  }
}
